newsID,title,content
115695,"सातामा १ प्रतिशत घट्यो नेप्से, कुन उपसमूहको परिसूचक कति बढ्यो? कति घट्यो?",
115711,"लगानीकर्ताले उठाए T+1 सेटलमेन्टको माग, सिडिएससी भन्छ-'सम्भव छ', ब्रोकर कम्पनी भन्छन् ‘अहिले आवश्यक छैन’",
115712,"शेयर ब्रोकर एसोसिएसनले दियो धितोपत्र बोर्डलाई १६ बुँदे सुझाव, के के छन् सुझाव",
115676,"'समग्र आर्थिक सूचक सकारात्मक छन्, नेप्से बढ्ने नै हो'",
115675,"एनआरएनको शेयर निष्कासन गर्न सरकार, उद्योग मन्त्रालय र राष्ट्र बैंकले नियम संशोधन गरे, अब पालाे बोर्डको",
115679,"स्वस्तिक लघुवित्तलाई आइपिओ बिक्री गर्न धितोपत्र बोर्डको अनुमति, चालु वर्ष अनुमति पाउने १२औँ संस्था",
115672,"नेप्सेले दियो गिरावटलाई निरन्तरता, कारोबार रकम भने बढ्यो",
115635,"'साउनदेखि बजार राम्रो हुने सम्भावना छ, लगानीकर्ताले कमाउने समय पनि यही हो'",
115643,"जीएमएलआई, एनएमआईसी, क्रेस्ट र ओएमपीएलको शेयर मूल्य २ हजार पुगेपछि मात्रै सप्लाई आयो, पियोरको सवालमा के होला ?",
115660,युनाइटेड अजोड इन्स्योरेन्सको लाभांश घोषणा,
115659,प्रि ओपन सेसन अपडेटः साढे २ अंक घट्यो नेप्से,
115639,"जेठ महिना ट्रेडरले बेस्सरी कमाए, सरकार पनि नाफामा, सिजन सुरु हुँदै गर्दा असार थप फलदायी होला ?",
115640,शक्ति संञ्चित गर्दै बजार !,
115633,"झिनो अंक घट्यो नेप्से, कारोबार रकम भने बढ्यो",
115619,प्रि ओपन सेसन अपडेटः सामान्य अंक घट्यो नेप्से,
115607,"बजार साइडवेजमा हुँदा पनि ४५ प्रतिशतसम्म कमाए हाइड्रोका लगानीकर्ताले, कसले कति कमाए र गुमाए? (सूचीसहित)",
115609,'बैंकका शेयर होल्डरहरु आईसीयूमा छन्',
115600,लघुवित्त कम्पनीहरुमा सिफ्ट हुँदै लगानीकर्ता,
115589,प्रि ओपन सेसन अपडेटः सामान्य अंक बढ्यो नेप्से,
115583,क्लियरिङ्ग र सेटलमेन्ट प्रक्रियामा समयसीमा छोट्याउने कार्य गर्न लगानीकर्ताको सुझाव,
115571,"नेप्से अध्यक्षविहीन, टिके अध्यक्ष बहिस्कार गर्दै नेप्सेले आफै अध्यक्ष चयन गर्न सक्छ ?",
115572,"अनेक फण्डाले नेप्सेमा हाइड्रोपावरको 'सधै राज', कुल रकमको ठूलो हिस्सा हाइड्रोमै खन्याउँदै",
115570,"समूहगत रणनीति बन्दै, अब सम्भावना कुन समूहको ?",
115564,होटल तथा पर्यटन उपसमूहका कम्पनीमा लगानीकर्ताको आकर्षण,
115551,प्रि ओपन सेसन अपडेटः साढे ३ अंक घट्यो नेप्से,
115534,"जलविद्युत क्षेत्रको शेयरमा एकोहोरिँदै लगानीकर्ता, ७० प्रतिशत कारोबार जलविद्युतको मात्रै",
115528,"होल्डिङ कम्पनीमा आकषर्ण, कसरी बन्दैछ रणनीति ?",
115523,"झिनाे अंक बढ्यो नेप्से, कारोबार रकम भने घट्यो",
115488,कुन कुन हाइड्रोपावर होल्ड गरिरहेका छन् म्युचुअल फन्डले ? सूचीसहित,
115508,प्रि ओपन सेसन अपडेटः करिब १ अंक घट्यो नेप्से,
115497,"गत साता सामान्य अंक बढेको नेप्से, यस साता के होला?",
115494,"‘पर्ख र हेर’ को अवस्थामा सानिमा बैंक, हेरौँ कम्पनी विश्लेषण",
115495,"वाणिज्य बैंकहरुको ब्याजदर फेरि घट्यो, कुनै बैंकको ब्याजदर कति?",
115479,"'साउन-भदौमा सिजनल कारोबारी बजारमा प्रवेश गर्छन, अहिले पनि बजारमा त्यस्तै संकेत देखिन थालेको छ'",
115470,"सातामा सामान्य अंक बढ्यो नेप्से, कुन उपसमूहको परिसूचक कति बढ्यो? कति घट्यो?",
115481,"९० भन्दा कम नेटवर्थको विषयमा दुई समितिको फरक मत, धितोपत्र बोर्ड सेफ ल्यान्डिङ गर्न खोज्दै, ऊर्जा व्यवसायीलाई राहत",
115455,"'उधारो कारोबार समस्या होइन, व्यवस्थित भने गर्नुपर्छ'",
115446,"नेप्सेले दियो गिरावटलाई निरन्तरता, कारोबार रकम भने बढ्यो",
115431,प्रि ओपन सेसन अपडेटः करिब १ अंक बढ्यो नेप्से,
115414,'बजार उच्च विन्दुमा हुँदा शेयर भिडाउने र न्यून विन्दुमा शेयर खोस्नेसँग जोगिन सक्नुपर्छ',
115419,"‘लक इन पिरियड’ खुल्न लागेका हाइड्रोपावरमा संस्थापक लगानी गर्ने कम्पनीमा लगानीकर्ताको आकर्षण, कुन हाइड्रोपावरमा कसको लगानी कति ?",
115418,"लामो समयदेखि बुढा कम्पनी भनेर हेपिएका जलविद्युत कम्पनीमा एकाएक चमक, के यसरी बढ्नु ठीक हो ?",
115417,"सूचक घट्बढ्सँग सरोकार छैन, बजार बढ्ने नै हो !",
115415,दुई दिनको वृद्धिपछि पुनः घट्यो नेप्से,
115398,अभियान लघुवित्तले लाभांश वितरण नगर्ने,
115398,अभियान लघुवित्तले लाभांश वितरण नगर्ने,
115397,प्रि ओपन सेसन अपडेटः सामान्य अंक घट्यो नेप्से,
115386,शिवाकोटी प्रतिवेदनले नेप्से पुनर्संरचना र नयाँ स्टक एक्स्चेन्ज खाेल्नका लागि दिएका मुख्य सुझावहरू यस्ता छन्,
115384,अब बजार बढ्ने नै हो !,
115383,"धितोपत्र बोर्डले सार्वजनिक गर्‍यो चिन्तामणि सिवाकोटीको अध्ययन प्रतिवेदन, निष्कर्ष नयाँ स्टक लाइसेन्स र नेप्सेको पुनर्संरचनामा",
115372,नेप्सेसँगै बढ्यो कारोबार रकम,
115358,प्रि ओपन सेसन अपडेटः १ अंक बढ्यो नेप्से,
115344,हाइड्रोपावर कम्पनीमै लगानीकर्ताको आकर्षण किन ?,
115341,एनआरएन फण्डको प्राथमिक निष्कासनमा संस्थापक र पब्लिकको हिस्सा कति हुने भन्ने गाँठो सेवोनले नफुकाइदिँदा आईपीओ नै अड्कियो,
115345,जोशी हाइड्रोले ६५ प्रतिशत हकप्रद शेयर निष्कासनका लागि अनुमति पायाे,
115343,"हाईड्रोमा चमक देखियाे, नेप्से बढ्ने सुर हो ?",
115336,जलविद्युत र अन्य उपसमूहका कम्पनीहरुमा लगानीकर्ताहरुको आकर्षण,
115310,नेप्से पुनर्संरचनाको कार्य योजना पेश गर्न बोर्डको निर्देशन आएपछि के गर्दै छ नेप्से ?,
115326,प्रि ओपन सेसन अपडेटः सामान्य अंक घट्यो नेप्से,
115313,‘लो क्याप’ बाट 'डिभिडेन्ट यिल्ड' कम्पनीमा सिफ्ट भएका हुन त लगानीकर्ता ?,
115308,लगानीकर्ताको रोजाईमा प्रतिफल दिने कम्पनी,
115305,"नेप्से घट्ने क्रम जारी, कारोबार रकममा भने वृद्धि",
115300,पुँजी बजारमा नयाँ उपकरण ल्याउन अर्थमन्त्री पौडेलकाे बाेर्डलाई सुझाव,
115290,समाज लघुवित्त मर्जर गर्न राष्ट्र बैंकको सैद्धान्तिक सहमति,
115289,प्रि ओपन सेसन अपडेटः साढे १ अंक घट्यो नेप्से,
115278,"गत साता करिब २ प्रतिशत घटेको नेप्से, यस साता के होला?",
115269,'कर्जा लिएर भएपनि शेयर बजारमा लगानी गरियो भने अहिलेको ब्याजदर भन्दा बढी लाभ गर्न सकिन्छ',
115263,"सातामा करिब २ प्रतिशत घट्यो नेप्से, कुन उपसमूहको परिसूचक कति बढ्यो? कति घट्यो?",
115268,"लगानीकर्ताका तीन संस्थाका प्रतिनिधिले नेप्सेका सीइओलाई दिए ज्ञापन, प्राविधिक आधुनिकीकरण र संस्थागत सुशासनमा जाेड",
115247,हकप्रद जारी गर्न पिपुल्स पावर कम्पनीको बुकक्लोज मिति तय,
115230,"नेप्सेमा सूचीकृत कम्पनी मध्ये करिब १६ प्रतिशत कम्पनीको नेटवर्थ ९० भन्दा मुनि, सबैभन्दा कम ४ सम्म (सूचीसहित)",
115234,लगानीकर्ता बाफियासँग डराउनु पर्दैन,
115185,'एक-दुई दिनको उतार चढाबले लगानीकर्ता डराइहाल्नु पर्ने अवस्था छैन',
115228,"निरन्तर तेस्रो कारोबार दिन घट्यो नेप्से, कारोबार रकम भने बढ्यो",
115215,नेप्सेकाे पुनर्संरचना र नयाँ स्टक एक्सचेञ्जको लाइसेन्स प्रक्रियाले उठाएकाे गम्भीर प्रश्नः रविन कँडेलकाे विचार,
115209,प्रि ओपन सेसन अपडेटः नेप्से ३ अंक बढीले घट्यो,
115202,हकप्रद निष्काशन प्रयोजनार्थ नेपाल इन्स्योरेन्सले तोक्यो बुकक्लोज मिति,
115193,"नयाँ स्टक एक्सचेन्जको लाइसेन्स बाँड्ने विषयमा सरकार एकातिर, शिवाकाेटी प्रतिवेदनलाई देखाउँदै बाेर्ड अध्यक्ष श्रेष्ठ अर्कोतिर",
115191,"ब्रोकरको पैसा नचलाउनुस, किन ?",
115188,"नेप्सेले दियो गिरावटलाई निरन्तरता, कारोबार रकम पनि घट्यो",
115175,प्रि ओपन सेसन अपडेटः करिब साढे १ अंक बढ्यो नेप्से,
115153,"बैंक र व्यवसायी छुट्टाउने विषयले शेयर बजार तरङ्गित, बैंक वित्तीय संस्थाको शेयरमा प्रेसर",
115158,साेमबारकाे बजार घट्नुमा बाफियाबारे गभर्नर पाैडेलकाे बाेली नै हाे त ?,
115157,दरमखोला हाइड्रो इनर्जी लिमिटेडले पायो आइपीओ निष्कासनको अनुमति,
115155,मंगलबार सबैभन्दा बढी कारोबार गरेका यी हुन टप फाइभ हाइड्रोपावर कम्पनीहरु,
115152,नेप्सेसँगै घट्यो कारोबार रकम,
115141,प्रि ओपन सेसन अपडेटः सामान्य अंक घट्यो नेप्से,
115137,लाभांश पारित गर्न हिमालयन लाइफ इन्स्योरेन्सको साधारण सभा आह्वान,
115124,"होटललाई उद्योग सरह मान्यता दिएपछि लगानीकर्ता होटलको शेयरप्रति आकर्षित, कस्ता छन् सूचीकृत कम्पनीहरु ?",
115122,"बजेटको उत्साहः बजारमा देखिएन, किन ?",
115118,"बजेटपछिको पहिलो कारोबार दिन ९ अर्बभन्दा बढीको कारोबार, सूचक भने सामान्य अंक बढ्यो",
115099,"बलियो बन्दै लगानीकर्ताको मनोभावना, बजारमा सकारात्मक माहोल निर्माण हुँदै",
115102,प्रि ओपन सेसन अपडेटः करिब २३ अंक बढ्यो नेप्से,
115084,"गत साता सामान्य अंक बढेको नेप्से, यस साता के होला?",
115086,रवि लामिछानेका कारण शेयर बजारमा लगानी गर्न हच्किएका एनआरएनको विश्वास फर्काउन सरकारले तुरुन्तै यस्तो निर्देशन दिनु पर्छ,
115079,बजेटको नयाँ व्यवस्थाले सूचीकृत लगानी कम्पनीहरुलाई के फाईदा ?,
114930,पुँजी लाभ कर:  विश्वका देशहरूले सेयर बजार नाफामा कसरी कर लगाउँछन्  र नेपालले के सिक्न सक्छ ?,
114931,"ऊर्जा व्यवसायी अख्तियारको निर्णय पर्खिँदै, अनुकूल निर्णय नआए सरकार र धितोपत्र बोर्ड विरुद्ध अदालत जाने तयारी",
115054,"हल्ला भए जस्तो लाभकरको दर बढेन, तर सरकारले शेयर बजारमा तिरेको करलाई यस पटक पनि अन्तिम भने मानेन",
115044,"सातामा सामान्य अंक बढ्यो नेप्से, कुन उपसमूहको परिसूचक कति बढ्यो? कति घट्यो?",
115058,"'पूँजीगत लाभकर बढ्छ भन्दै बजारलाई आंतकित बनाउने बिषय आइदिएन, त्यसले नै सबै भन्दा ठूलो गुन लगाएको छ'",
115028,"बजेट शेयर बजार मैत्री, बजार बढ्नेमा लगानीकर्ता आशावादी",
115025,"सूचीकृत इन्भेष्टमेन्ट कम्पनी सरकारको प्राथमिकतामा, प्राइभेट इक्विटी र भेन्चर्स क्यापिटललाई प्रोत्साहन",
115020,"बजेट निजी क्षेत्र मैत्री रहेको व्यवसायीको प्रतिक्रिया, कार्यान्वयनमा गरे आशङ्का",
114934,बजेट आउने अघिल्लाे दिन किन भयो सूचकमा वृद्धि,
114928,"बजेटकाे अघिल्लाे दिन नेप्से बढ्यो दोहोरो अंकले, एकाएक वाणिज्य बैंकहरुकाे शेयर मूल्य किन बढ्याे ?",
114926,'हल्लाको कुरा सुनेर हतार गर्नु भन्दा केही दिन पर्खन उचित हुन्छ',
114919,प्रि ओपन सेसनमा नेप्से परिसूचक सामान्य घट्यो,
114918,हिमालयन लाइफ इन्स्योरेन्सको लाभांश घोषणा,
114914,सगरमाथा जलविद्युतको हकप्रद विद्युत नियमन आयोगबाट स्वीकृत,
114912,"बरुण हाईड्रोपावरको बुक क्लोज मिति तय, कहिलेसम्म कायम शेयरधनीले हकप्रद खरिदगर्न सक्ने ?",
114908,एशियन लाइफ इन्स्योरेन्सको हकप्रद सुरक्षित गर्ने आज अन्तिम दिन,
114906,राप्ती हाइड्रोको हकप्रद शेयरमा कहिलेदेखि आवेदन गर्न सकिन्छ ?,
114896,"किन बढ्न मानिरहेको छैन शेयर बजार, अझै किन छ ‘पर्खर र हेर’कै अवस्था",
114897,सान्भि इनर्जीमा माग भन्दा १०.७१ गुणा शेयर माग,
114889,"ओम मेगाश्री र पिओर इनर्जीको संस्थापक शेयर अझै खातामा गएन, छुट्टाछुट्टै सिम्बोलको लफडामा सिडिएससीलाई गलाउन खोज्दै नेप्से",
114892,शेयर बजारमा पुँजीगत लाभकर नै अन्तिम कर हुनुपर्छ,
114894,"कान्तिपुर फर्मास्यूटिकल्सको आईपीओ आउँदै, एलिट क्यापिटलसँग सम्झौता",
114885,"नेप्से सामान्य बढ्यो, कारोबार रकममा निरन्तरको गिरावट",
114871,प्रि ओपन सेसनमा नेप्से परिसूचक सामान्य घट्यो,
114870,पूँजी बजारमा फेरि लाभकर आतंक किन ?,
114868,स्पेशल प्रि ओपन सेसनमा पियोर इनर्जीको कतिमा भयो पहिलो कारोबार ?,
114858,सान्भि इनर्जीको आईपीओमा आवेदन दिने आज अन्तिम दिन,
114848,"राष्ट्र बैंकको ओखतीले  काम गरेन,परिवर्तित  जोखिम भारलाई बजारले गर्‍यो रिजेक्ट ? के लगानीकर्ताले बजेट नै कुरेका हुन् ?",
114850,बजारले राष्ट्र बैंकको सकारात्मक कदमलाई किन गरेन स्वागत ?,
114851,इन्भेष्टर्स फाेरमले दियाे गभर्नरलाई पूँजी बजार सुधारका तीन सुझाव,
114843,"राष्ट्र बैंकले लचिलाे नीति ल्याउँदा पनि बढेन बजार, नेप्सेसँगै करोबार रकम पनि घट्याे",
114841,"पियोर इनर्जीको आईपीओको शेयर सूचीकृत, ओपनिङ रेन्ज कति ?",
114839,हिम स्टार ऊर्जा कम्पनीलाई आईपीओ निष्काशन गर्न अनुमति,
114830,प्रि ओपन सेसनमा नेप्से परिसूचक ३२.७० बढ्यो,
114829,राष्ट्र बैंकले मौद्रिक समीक्षा मार्फत जाेखिम भार घटाउने निर्णयलाई लगानीकर्ताले गरे स्वागत,
114820,"हरेक पटक लगानीकर्ताले उठाउँदै आएको अन्तिम करको विषय यस पटक सम्बोधन हुने अपेक्षा, यो बजेटले सम्बोधन गर्ला  ?",
114821,अझै लगानीकर्ता किन ढुक्क हुन सकेनन ?,
114818,नेप्से घटेपनि माईक्रोफाइनान्स समूहको परिसूचक सबै भन्दा धेरै बढ्याे,
114808,प्रि ओपन सेसन अपडेटः साढे ४ अंक बढ्यो नेप्से,
114800,"गत साता करिब ३ प्रतिशत बढेको नेप्से, यस साता के होला?",
114755,"गभर्नरले पुँजी बजारको योगदान समग्र अर्थतन्त्रमा पुगोस् भन्ने चाहना राख्नु भएकाे छ,अब बजार प्रभावकारी हुन्छ",
