newsID,title,content
114762,‘इधरका माल उधर’ गरेर बनाएको निर्यात कीर्तिमानमा कति खुसी हुने ? कीर्तिमानको वास्तविकता यस्तो छ,
114779,"'गभर्नर राजनीति व्यक्ति हुँदा हुँदै योग्य व्यक्ति नियुक्ति हुनु भएकाे छ, बजार सुधार हुनेमा आशावादी हुन सकिन्छ'",
114788,"सातामा करिब ३ प्रतिशत बढ्यो नेप्से, कुन उपसमूहको परिसूचक कति बढ्यो? कति घट्यो?",
114791,"सरकारले पूँजी बजारमा ६ महिना देखि १ वर्ष भित्रमा यस्ता परिवर्तन गर्ने योजना बनायो, सम्भव होला ?",
114794,बुद्धिस्ट इन्टरनेशनल ट्राभल मार्ट सुरु: नेपाललाई बौद्ध र आध्यात्मिक पर्यटनको विश्व केन्द्र बनाउने लक्ष्य,
114767,'बुलिस र बियरिस ट्रेण्ड परिवर्तन ! बजारमा नीतिगत स्पष्टता जरुरी छ',
114761,नेप्से बढेपनि कारोबार रकम भने घट्यो,
114724,"'माग भए अनुसारका कागजातहरु पेश भएपछि बोर्डले आईपीओ स्वीकृती गर्छ, त्यसमा कुनै ढिलाई हुँदैन'",
114744,'उतारचढावसँग डराउनु पर्दैन विस्तारै बजार सन्तुलित हुन्छ',
114754,प्रि ओपन सेसन अपडेटः साढे ४ अंक बढ्यो नेप्से,
114741,हकप्रद शेयर जारी गर्न नेपाल इन्स्योरेन्सलाई बोर्डको स्वीकृती,
114740,हिमालयन रि इन्स्योरेन्सको लाभांश सुरक्षित गर्ने आज अन्तिम दिन,
114734,"नयाँ गभर्नरलाई शेयरबजारले देखायो रातो झन्डा, यसअघिका तीन गभर्नरले पदभार ग्रहण गर्दा के भएको थियो बजार ?",
114728,"‘प्रि ओपन’मा मात्तिएको शेयर बजार अन्तिममा किन आत्तियो ? सूचक टुप्पोबाट झण्डै १०० अंक घट्यो, सबै ‘कन्फ्युज’",
114729,बुधवारकाे बजारकाे लय अपेक्षित नै हाे,
114723,"दुई दिनको निरन्तर वृद्धिपछि सामान्य अंक घट्यो नेप्से, कारोबार रकम भने बढ्यो",
114710,नवनियुक्त गभर्नरले गरे सपथ ग्रहण,
114709,हकप्रद शेयर जारी गर्न एसियन लाइफको बुक क्लोज मिति तय,
114705,प्रि ओपन सेसन अपडेटः करिब ३५ अंक बढ्यो नेप्से,
114689,"९० भन्दा कम नेटवर्थ भएका जम्मा १३ कम्पनी, तर अरू कम्पनीले पनि किन निष्कासन अनुमति पाएका छैनन् ?",
114692,नेटवर्थ ९० भन्दा तलकाे कम्पनीले  शेयर जारी गर्न नपाउने हाे ? यसाे भन्छन् सेबाेनका प्रवक्ता  घिमिरे,
114685,केन्द्रीय बैंकले नयाँ गभर्नर पाउने भएपछि ४९ अंकले बढ्याे बजार,
114675,प्रि ओपन सेसन अपडेटः सामान्य अंक घट्यो नेप्से,
114655,"चैतको तुलनामा वैशाखमा पूँजीगत लाभकर ७७% बढ्यो, स्टक डिलरकाे वृद्धि  प्रतिशत सबैभन्दा बढी, संस्थागत लगानीकर्ता दोस्रोमा",
114657,बजार बढ्नुमा कसको कति योगदान ?,
114624,"लघुवित्तको नाफा बढेपछि खराब कर्जा घट्नु पर्ने तर झन झन बढ्यो, कसरी ?",
114651,"६ कारोबार दिनको गिरावट पछि बढ्यो नेप्से, कारोबार रकम भने घट्यो",
114637,प्रि ओपन सेसन अपडेटः करिब साढे २ अंक घट्यो नेप्से,
114623,"सिजनमै शेयर बजार किन सुस्तायो ? लगानीकर्ताका आ-आफ्नै तर्क, सोमबारदेखि भने बढ्ने एकथरिको अनुमान",
114622,निरन्तर घटेको बजारमा नाफा छैन ! कस्तो कारोबार भएको छ ?,
114615,"सामान्य अंक घट्यो नेप्से, कारोबार रकम भने बढ्यो",
114605,प्रि ओपन सेसन अपडेटः साढे ३ अंक घट्यो नेप्से,
114585,दोस्रो बजारमा ब्रोकरले दिने मार्जिन ट्रेडिङ सेवा: आठ वर्षको अन्योल र अन्ततः लाइसेन्स खारेजीको सम्भावना,
114595,"गत साता करिब २ प्रतिशत घटेको नेप्से, यस साता के होला?",
114589,"३५ प्रतिशतले बढ्यो लघुवित्तको नाफा, अध्यक्ष यादव भन्छन्–‘साँवा तिर्न नसकेपनि व्याज भुक्तानी गर्न थालेपछि नाफा बढ्याे’",
114579,"'हर्षद मेहता काण्ड अहिलेको बजारमा दैनिक भएको छ, यस्तो गतिविधि रोक्ने कुनै कानुन बनेको छैन ?'",
114577,"सातामा करिब २ प्रतिशत घट्यो नेप्से, कुन उपसमूहको परिसूचक कति बढ्यो? कति घट्यो?",
114560,लगानी समूहका सात कम्पनीमा कुनको अवस्था कस्तो ?,
114554,"संस्थापक र साधारण शेयरका छुट्टाछुट्टै सिम्बोल बनाउने सिडिएससीको प्रयास, तर नेप्सेको आनाकानी",
114558,'बलियो बजार बनाउन बैंकको लगानी बढ्नै पर्छ',
114553,नेप्से र कारोबार रकम दुबै घट्यो,
114552,उत्पादन तथा प्रशोधन समूहका कम्पनीको अवस्था कस्तो ?,
114539,प्रि ओपन सेसन अपडेटः ३ अंक बढ्यो नेप्से,
114537,लाईफ इन्स्योरेन्स कर्पोरेशनकाे लाभांश घोषणा,
114532,"सर्वोत्तम सिमेन्टको नाफा उल्लेख्य बढ्यो, ईपीएस कति?",
114519,कस्तो बन्धनमा पर्यो बजार ?,
114515,"नेप्सेले दियो गिरावटलाई निरन्तरता, कारोबार रकम पनि घट्यो",
114513,वित्तीय विवरणलाई तराजुमा राखेर हेर्दा होटल तथा पर्यटन समूहका कम्पनीको प्रगति कसकाे कस्तो ?,
114498,प्रि ओपन सेसन अपडेटः करिब १ अंक बढ्यो नेप्से,
114497,नेशनल लाईफ इन्स्योरेन्सको लाभांश घोषणा,
114485,किन बढ्न सकेन बजार ?,
114477,"निरन्तर तेस्रो कारोबार दिन घट्यो नेप्से, कारोबार रकम पनि घट्यो",
114450,व्यवसायिक वृद्धिसँगै सोल्टी होटलको नाफा बढ्यो,
114452,प्रि ओपन सेसन अपडेटः करिब साढे १ अंक बढ्यो नेप्से,
114446,"सिईडिबि होल्डिङग्सको नाफामा उच्च वृद्धि, ईपीएस पनि उल्लेख्य बढ्यो",
114443,मुक्तिनाथ कृषि कम्पनीको नाफा सामान्य बढ्यो,
114437,नाफासँगै बढ्यो एनआरएन इन्फ्रास्ट्रक्चरको प्रतिशेयर आम्दानी,
114424,"बुटवल पावरका तीन जना सञ्चालक न्यादिमा पनि, सञ्चालक हुँदा हुँदै बुटवल पावरले शेयर बिक्री गर्न मिल्छ?",
114394,"सिजन सुरु हुनै लाग्दा शेयर बजार साइडवेजमा, सूचक २६ सयको लाइनमा घुमेको घुम्यै किन गरिरहेको हो ?",
114391,"समूहगत रणनीतिमा लगानीकर्ता, होटलमा बढ्यो आकर्षण",
114384,होटल तथा पर्यटन उपसमूहमा लगानीकर्ताको आकर्षण,
114370,हिमालयन हाईड्रोपावरले हकप्रद जारी गर्न आयोगको पूर्व स्वीकृत लिने,
114366,प्रि ओपन सेसन अपडेटः झिनो अंक घट्यो नेप्से,
114360,एनएलजी इन्स्योरेन्सको लाभांश घोषणा,
114359,एचआईडिसिएलको नाफा र प्रतिशेयर आम्दानी दुबै घट्यो,
114358,नेको इन्स्योरेन्सको लाभांश सुरक्षित गर्ने आज अन्तिम दिन,
114350,नाफा बढेपनि नागरिक लगानी कोषको ईपीएस घट्यो,
114351,"गत साता करिब साढे १ प्रतिशत बढेको नेप्से, यस साता के होला?",
114338,"'एकदिनमा हुने पूँजीगत लाभ वास्तविक होइन, अरुको खोसिएको मात्रै हो'",
114317,"सातामा करिब साढे १ प्रतिशत बढ्यो नेप्से, कुन उपसमूहको परिसूचक कति बढ्यो? कति घट्यो?",
114332,बोर्डका अध्यक्ष श्रेष्ठले जलविद्युत् कम्पनीको अडिट प्रतिवेदनलाई के आधारमा फर्जी भने ? अडिटरले हस्ताक्षर गरेको प्रतिवेदनलाई फर्जी भन्न मिल्छ?,
114303,जलविद्युत् कम्पनीले आफ्ना सहायक कम्पनीको शेयर बिक्री गर्न पाउँछन् कि पाउँदैनन् ? बोर्डका अधिकारीले यसो भने,
114309,रिलायन्सको आईपीओ नरोक्न अदालतको आदेश,
114305,मूल्य बढाउने नीतिले बजार क्र्यास बनाउँछ !,
114299,नेप्से घटेपनि कारोबार रकममा वृद्धि,
114272,"'नेप्सेमा हैन, केही कम्पनी सुपर बुल भइसके'",
114274,किन खन्याउँदैछन् लगानीकर्ताले हाइड्रोपावरमा पैसा ?,
114273,‘‘म फेरि फेल भए ३२ सय कट्न कसैले रोक्न सक्दैन’’,
114268,नेपाल शेयर बजार लगानीकर्ता संघको पहिलो पत्रकार सम्मेलन सम्पन्न,
114267,एक्कासी ६२ अंकले किन बढ्यो शेयर बजार ? यस्ता कारणले बढेको लगानीकर्ताको विश्लेषण,
114262,दुई महिना पछि नेप्सेमा उत्साहजनक वृद्धि,
114221,"अडलट अर्डर देखिने बनाउने नेप्सेको तयारी, अर्डर कहिले देखिने होला ?",
114239,प्रि ओपन सेसन अपडेटः करिब साढे २ अंक बढ्यो नेप्से,
114227,नयाँ लघु बीमा कम्पनीहरु एनएमआईसी र क्रेस्टको मूल्य कतिसम्म पुग्ला ?,
114225,स्मार्ट मनीले अपुर्चुनिटी देखाउँछ !,
114223,"गभर्नर नियुक्तिमा गठबन्धनमा कुनै समस्या छैन, राष्ट्र बैंक भित्रै समस्या छ : देउवा",
114219,सामान्य अंकले बढ्यो नेप्से,
114215,शेयर बजारको वर्तमान परिदृश्यका बारेमा गहन छलफल गरिदै,
114198,प्रि ओपन सेसन अपडेटः करिब २ अंक घट्यो नेप्से,
114189,कालिका लघुवित्तको नाफा उल्लेख्य बढ्यो,
114180,"यता धितोपत्र बोर्डले आईपीओ स्वीकृति नदिने, उता स्थानीयले शेयर नदिएको भन्दै आयोजनाको काम मै अवरोध गर्न थाले",
114181,"नेप्से सूचकले लिएन गति, बजारले के पर्खेको छ ?",
114176,निरन्तर पाँचौ कारोबार दिन घट्यो नेप्से,
114160,प्रि ओपन सेसन अपडेटः २ अंक घट्यो नेप्से,
114146,"पुराना भन्दा नयाँ कम्पनीमा लगानीकर्ताको आकर्षण, २० दिन अपर सर्किट, किन नयाँ कम्पनीमा लगानीकर्ता बढी आकर्षित हुन्छन् ?",
114145,अबको बजार सकारात्मक नै हो !,
114138,"सामान्य अंक घट्यो नेप्से, कारोबार रकममा पनि गिरावट",
114136,शेयर बजारमा मौसमी नीतिको प्रभाव,
114076,"नेप्सेले एसएमइ प्लेटफर्म सम्बन्धी विनियमावलीको  मस्यौदा तयार गर्‍यो, अब स्वीकृत हुन बाँकी, यस्ता छन् नयाँ व्यवस्था ?",
114118,प्रि ओपन सेसन अपडेटः ४ अंक बढ्यो नेप्से,
114108,"गत साता करिब साढे १ प्रतिशत घटेको नेप्से, यस साता के होला?",
114067,"सातामा करिब साढे १ प्रतिशत घट्यो नेप्से, कुन उपसमूहको परिसूचक कति बढ्यो? कति घट्यो?",
114101,शाङ्घाई अटो शो २०२५ मा एक्सपेंगले  ह्युमनॉइड रोबोट ‘आयरन’ सार्वजनिक गर्यो,
114099,"'शेयर बजार अस्थिर नीतिको दवावमा, विशेष नीतिको आवश्यकता'",
114077,तेर्हथुम पावरलाई हकप्रद निष्काशन अनुमति,
114036,ठूलो कित्ताको म्याचिङ कारोबार गर्दै शेयर मूल्य बढाउँदै,
114027,"चालु वर्ष थप ८ पुराना ब्रोकरले चुक्ता पूँजी पुर्‍याए, एसोसिएसन भन्छ ”ब्रोकर कम्पनी मर्ज हुँदैनन् ”",
114025,"'बजारमा तीन किसिमका लगानीकर्ता छन्-‘बकुल्ला', ‘किङ्ग फिसर’ र 'म्यानुपुलेटर', अहिले पहिलाे र दाेस्राे 'हेरेकै हेरै' तेस्राेले कमाएकाे अवस्था छ'",
114035,"नेप्सेले संस्थापक शेयर कारोबारको लागि सानो प्राविधिक परिवर्तन नगरिदिँदा HEIP, NIMBP र HIDCLP यसरी निर्बाध कारोबार हुन पाएनन्",
114039,"ओम मेगाश्री फर्मास्युटिकल्सको आईपीओ सूचीकृत, आइतबारदेखि कारोबार हुने",
114029,"निरन्तर तेस्रो कारोबार दिन घट्यो नेप्से, कारोबार रकम भने बढ्यो",
113996,"राष्ट्र बैंकले २० प्रतिशत शेयर बिक्री गर्न दिँदा बैंकहरुले शेयर ट्रेडिङ गरेर सात अर्ब कमाए, सबैभन्दा बढी कुन बैंकले कमायो ? (सूची सहित)",
114009,प्रि ओपन सेसन अपडेटः सामान्य अंक घट्यो नेप्से,
114000,यी हुन सबैभन्दा सस्ता ३० कम्पनी (सूचीसहित),
113992,'अबको दुई वर्ष भित्र नेप्से ५१ सय माथि पुग्छ',
113986,नेप्सेले दियो गिरावटलाई निरन्तरता,
113974,प्रि ओपन सेसन अपडेटः करिब २ अंक बढ्यो नेप्से,
113965,आम्दानीसँगै घट्यो हाथवे इन्भेष्टमेन्टको नाफा,
113959,शेयर बजारबाट कस्ता लगानीकर्ताले कमाई गरेका छन् ?,
113958,"चैतमा सामूहिक लगानी कोषहरूको साधारण र मुद्दती निक्षेप दुवै बढ्यो, निक्षेप बढ्दा न्याभ भने घट्यो",
113955,नेप्सेसँगै घट्यो कारोबार रकम,
113940,प्रि ओपन सेसन अपडेटः सामान्य अंक घट्यो नेप्से,
113924,"थाहा पाउनेले जति पनि डिम्याट खाता खोल्दै, केही लगानीकर्ताले भने ब्रोकरलाई दुईको नियम देखाएर यसरी ठग्दै",
113922,बजारमा छोटो टार्गेट राख्नेले यसरी नाफा गर्दै छन्,
113919,"एक अर्बकाे आईपीओ जारी गर्ने तयारीमा जनता एग्रो, संचालकहरु को को छन् ?",
113918,"नेप्सेले दियो वृद्धिलाई निरन्तरता, कारोबार रकम पनि बढ्यो",
113907,प्रि ओपन सेसन अपडेटः सामान्य अंक घट्यो नेप्से,
113901,"गत साता करिब साढे २ प्रतिशत घटेको नेप्से, यस साता के होला?",
113854,"अढाई महिनामा ६ हाइड्रोपावरको संस्थापक सेयरको ‘लक इन पिरियड’ खुल्दै, ४ करोड भन्दा बढी कित्ता शेयर सप्लाई बढ्ने",
113892,'बैंक हो भन्दैमा जवरजस्ती फण्डामेन्टल मानिदिनु पर्छ भन्ने पक्षमा म छैन',
113881,"सातामा करिब साढे २ प्रतिशत घट्यो नेप्से, कुन उपसमूहको परिसूचक कति बढ्यो? कति घट्यो?",
113889,"राष्ट्र बैंकले कारबाही गरेका कम्पनीको शेयर नै “हट केक”, शेयर बजार कसले चलाउँदै छ ?",
113850,"धितोपत्र बोर्डमा अध्यक्ष पनि छन् ? भन्दै व्यङ्ग्य गर्न थाले लगानीकर्ताले, सय दिने उपलब्धि किन सार्वजनिक भएन ?",
113848,नेप्से र कारोबार रकम दुबै बढ्यो,
113834,प्रि ओपन सेसन अपडेटः सामान्य अंक बढ्यो नेप्से,
113824,दुई लघुवित्तको शेयरमूल्य समायोजन,
113812,"फेरि नेप्से पुनर्संरचनाको प्रस्ताव गरिँदै, शेयर संरचनाको विषय सञ्चालक समितिले टुङ्ग्याउने",
113810,"नेप्से घट्ने क्रम जारी, कारोबार रकम पनि घट्दो",
113800,महालक्ष्मी विकास बैंक सबैभन्दा कम कोष लागत भएको विकास बैंक,
113792,प्रि ओपन सेसन अपडेटः सामान्य अंक घट्यो नेप्से,
113767,"ब्रोकरले भुक्तानी दिन नसकेपछि 'लिमिट टाइट' गर्न थाले, उता धितोपत्र बोर्डले ब्रोकरहरूलाई चिठी काट्न थाल्यो",
113771,"निरन्तर तेस्रो कारोबार दिन घट्यो नेप्से, कारोबार रकम पनि घट्यो",
113752,प्रि ओपन सेसन अपडेटः ३ अंक घट्यो नेप्से,
113744,"विकास बैंकको शेयर मूल्यमा ‘लो शेयर सप्लाई’को असर, २१ रुपैयाँ मात्रै नेटवर्थ रहेको नारायणी विकास बैंककाे मूल्य झन्डै १८ सय",
113739,साइडबेजमा रहेकाे बजारले शक्ति सञ्चय गर्दै,
